{
    "$schema": "http://json-schema.org/draft-07/schema#",
    "type":"object",
    "properties": {
        "success":{
            "type":"boolean"
        },
        "title": {
            "type": "string"
        },
        "description": {
            "type": "string"
        },
        "image":{
            "type": "string"
        },
        "repository": {
            "type": "string"
        },
        "languages": {
            "type": "array",
            "items":{
                "type": "string"
            }
        },
        "tags":{
            "type": "array",
            "items": {
                "type": "string"
            }
        },
        "keywords": {
            "type": "string"
        }
    },
    "required": [
        "success",
        "title",
        "description",
        "repository",
        "languages",
        "tags",
        "keywords"
    ]
}