{
    "success": true,
    "title": "jsonapiunit",
    "description": "A typescript like unit testing tool to test JSON REST APIs.",
    "image": "img/opengraph/projects/jsonapiunit.png",
    "repository": "https://github.com/whizsid/jsonapiunit",
    "languages": [
        "rust"
    ],
    "tags":["unit-testing","cli"],
    "keywords": "Typescript,Unit Testing, JSON, API, Variable Create, Codeless"
}